{
  "schema_version": "content-generation.project-brief.v2",
  "project": "",
  "audience": [],
  "problem": "",
  "solution": "",
  "mechanism": [],
  "evidence": [
    {
      "claim": "Replace with a material, bounded claim about the project.",
      "source": "Name the test, implementation, decision, or publication inspected.",
      "status": "unknown",
      "supports": "State what the inspected evidence establishes in plain language.",
      "limits": "State what this evidence does not establish in plain language.",
      "recorded_at": "YYYY-MM-DDThh:mm:ssZ",
      "source_revision": {
        "kind": "unknown_search",
        "reference": "Record the search scope that did not establish this claim.",
        "observed_at": "YYYY-MM-DD"
      },
      "cite_in_readme": false
    }
  ],
  "boundaries": [],
  "must_preserve": [
    "Replace this with one concise, evidence-backed boundary sentence that must appear verbatim in the README."
  ],
  "terminology": {
    "preferred": {},
    "avoid": []
  }
}
